The Name,Words,Numbers,Series,Updated At,Email,Zip,ASC
Curran N. Bowen,interdum enim non nisi. Aenean eget metus. In nec orci.,scelerisque mollis. Phasellus libero,131,"Sat, 06 Aug 2011 13:41:09 -0700",arcu@Aliquamnec.ca,V3Q 2F2,175
Meghan Y. Obrien,"pede. Cum sociis natoque penatibus et magnis dis parturient montes,","Quisque imperdiet, erat nonummy ultricies",132,"Sat, 24 Sep 2011 14:30:40 -0700",Nunc.mauris.sapien@etmagnaPraesent.org,G7N 7V8,176
Sage E. Wade,Curabitur dictum. Phasellus in felis. Nulla tempor augue ac ipsum.,fringilla.,133,"Fri, 15 Feb 2013 23:03:19 -0800",malesuada.fames@Nullafacilisi.edu,47240,177
Nelle S. Daugherty,ac arcu. Nunc mauris. Morbi non sapien molestie orci tincidunt,"eget, volutpat ornare, facilisis eget, ipsum. Donec sollicitudin adipiscing",134,"Wed, 23 Jan 2013 22:17:18 -0800",Donec.sollicitudin.adipiscing@musProin.ca,I7E 3X3,178
Eugenia Y. Avila,vitae purus gravida sagittis. Duis gravida. Praesent eu nulla at,sem molestie sodales. Mauris blandit,135,"Mon, 04 Jun 2012 07:51:25 -0700",Integer@sempererat.com,Y9H 6G1,179
Yolanda N. Beck,Praesent luctus. Curabitur egestas nunc sed libero. Proin sed turpis,"velit dui, semper et, lacinia vitae,",136,"Wed, 14 Sep 2011 13:04:19 -0700",Aliquam.tincidunt.nunc@tristique.edu,45936,180
Hermione W. Little,"faucibus lectus, a sollicitudin orci sem eget massa. Suspendisse eleifend.",lorem tristique,137,"Mon, 11 Feb 2013 22:37:43 -0800",hymenaeos.Mauris.ut@nasceturridiculusmus.org,Y7I 1H8,181
Leila U. Melton,"eu, ultrices sit amet, risus. Donec nibh enim, gravida sit",netus et malesuada fames ac turpis egestas.,138,"Fri, 12 Oct 2012 10:12:00 -0700",Suspendisse.tristique.neque@ligula.org,80174,182
Harper D. Kirk,"montes, nascetur ridiculus mus. Aenean eget magna. Suspendisse tristique neque","Donec elementum, lorem",139,"Tue, 26 Feb 2013 01:06:44 -0800",porttitor@auctorvitaealiquet.ca,28386,183
Sylvia L. Lowe,magna. Praesent interdum ligula eu enim. Etiam imperdiet dictum magna.,et ultrices,140,"Fri, 13 Jan 2012 10:19:04 -0800",morbi.tristique.senectus@necquam.ca,43995,184
Lois I. Burke,"sem. Pellentesque ut ipsum ac mi eleifend egestas. Sed pharetra,",non lorem vitae odio sagittis semper. Nam,141,"Sat, 18 May 2013 16:07:29 -0700",non.justo.Proin@sedsapienNunc.com,X1E 5M7,185
Mary O. Craft,"urna, nec luctus felis purus ac tellus. Suspendisse sed dolor.","vitae, posuere at, velit. Cras lorem",142,"Fri, 13 Jul 2012 10:50:37 -0700",sagittis.Duis@sedconsequat.edu,27655,186
Hall I. Pickett,"imperdiet non, vestibulum nec, euismod in, dolor. Fusce feugiat. Lorem",Nullam feugiat placerat velit. Quisque varius. Nam,143,"Sun, 10 Feb 2013 18:37:25 -0800",ipsum.Suspendisse@eleifend.edu,98314,187
Tanek S. Pate,"molestie orci tincidunt adipiscing. Mauris molestie pharetra nibh. Aliquam ornare,","aliquet diam. Sed diam lorem, auctor quis, tristique ac,",144,"Fri, 06 Jan 2012 10:57:38 -0800",imperdiet@pharetranibhAliquam.org,82965,188
Yardley Z. Durham,ornare egestas ligula. Nullam feugiat placerat velit. Quisque varius. Nam,id risus quis,145,"Sat, 13 Apr 2013 23:32:10 -0700",Cum.sociis.natoque@atarcuVestibulum.edu,V7H 5K5,189
Hoyt P. Reynolds,malesuada fringilla est. Mauris eu turpis. Nulla aliquet. Proin velit.,"lectus pede et risus. Quisque libero lacus,",146,"Wed, 26 Sep 2012 01:46:11 -0700",tellus@arcueuodio.com,X3Q 8Q8,190
Buffy E. Jackson,"Aenean massa. Integer vitae nibh. Donec est mauris, rhoncus id,",lacus. Nulla,147,"Mon, 12 Nov 2012 07:04:03 -0800",risus.Nulla@fermentum.org,J9G 9K9,191
Sophia G. Johnston,Praesent eu dui. Cum sociis natoque penatibus et magnis dis,mauris sagittis placerat. Cras dictum ultricies ligula. Nullam enim.,148,"Thu, 31 Jan 2013 22:06:41 -0800",et@auctorvelitAliquam.org,O7Y 7X1,192
Brian D. Henson,"eu, ligula. Aenean euismod mauris eu elit. Nulla facilisi. Sed",Donec tincidunt. Donec,149,"Wed, 01 May 2013 19:41:17 -0700",tincidunt.orci.quis@fringillaporttitorvulputate.org,W4P 2C4,193
Martin D. Burnett,eu augue porttitor interdum. Sed auctor odio a purus. Duis,"Sed congue, elit sed consequat auctor, nunc nulla vulputate",150,"Fri, 11 Jan 2013 11:32:12 -0800",ac.risus.Morbi@sagittisaugue.edu,Y2U 2K0,194
Shaine P. Britt,"hendrerit. Donec porttitor tellus non magna. Nam ligula elit, pretium","nec,",151,"Wed, 10 Aug 2011 11:46:20 -0700",enim.Curabitur.massa@Morbinon.edu,66881,195
Marah B. Mcbride,"feugiat. Lorem ipsum dolor sit amet, consectetuer adipiscing elit. Aliquam",Integer,152,"Sat, 21 Apr 2012 20:10:32 -0700",accumsan@utquamvel.com,62778,196
Hakeem B. Schneider,Pellentesque habitant morbi tristique senectus et netus et malesuada fames,a tortor. Nunc commodo auctor velit. Aliquam nisl.,153,"Sun, 16 Sep 2012 06:28:50 -0700",eget.ipsum@egetmetus.com,W5W 4P8,197
Kasimir X. Jacobs,"vitae, aliquet nec, imperdiet nec, leo. Morbi neque tellus, imperdiet",Curabitur dictum. Phasellus in,154,"Thu, 09 May 2013 18:45:26 -0700",lobortis@ultricessitamet.edu,34444,198
Clio V. Carlson,"sem elit, pharetra ut, pharetra sed, hendrerit a, arcu. Sed",volutpat nunc sit amet metus. Aliquam,155,"Thu, 26 Apr 2012 16:49:20 -0700",tellus.id@sollicitudincommodoipsum.org,N5S 1K6,199
Evangeline X. Mayo,Duis dignissim tempor arcu. Vestibulum ut eros non enim commodo,"dolor elit, pellentesque a, facilisis",156,"Wed, 07 Nov 2012 06:02:07 -0800",risus.Donec@accumsansedfacilisis.org,O8K 4T9,200
Demetrius S. Cantrell,"sit amet, consectetuer adipiscing elit. Aliquam auctor, velit eget laoreet",tristique,157,"Fri, 05 Aug 2011 09:19:05 -0700",bibendum@eterosProin.org,O9U 5M2,201
Stone I. Burgess,nascetur ridiculus mus. Donec dignissim magna a tortor. Nunc commodo,"varius et,",158,"Wed, 18 Jul 2012 07:42:47 -0700",In.condimentum.Donec@iaculisaliquetdiam.edu,I4O 1J6,202
Graiden G. Leon,"purus. Maecenas libero est, congue a, aliquet vel, vulputate eu,",facilisis. Suspendisse commodo tincidunt,159,"Sat, 06 Jul 2013 14:03:20 -0700",interdum.Nunc@Integervitaenibh.com,J3K 7Y5,203
Lacey H. Tucker,"Proin nisl sem, consequat nec, mollis vitae, posuere at, velit.",Suspendisse eleifend. Cras,160,"Tue, 04 Oct 2011 00:29:39 -0700",cursus.in.hendrerit@PhasellusornareFusce.org,W9R 2D0,204
Aladdin A. Kline,pede. Cras vulputate velit eu sem. Pellentesque ut ipsum ac,turpis. Nulla aliquet. Proin velit. Sed malesuada,161,"Mon, 25 Jul 2011 13:26:58 -0700",nec@sociisnatoque.org,2544,205
Rhona D. Sandoval,placerat velit. Quisque varius. Nam porttitor scelerisque neque. Nullam nisl.,egestas ligula. Nullam feugiat placerat velit.,162,"Sat, 17 Mar 2012 22:55:56 -0700",Vestibulum.ante.ipsum@ut.com,C5L 6L2,206
Desiree J. Simpson,"aptent taciti sociosqu ad litora torquent per conubia nostra, per",volutpat. Nulla facilisis. Suspendisse commodo tincidunt,163,"Wed, 03 Oct 2012 02:07:26 -0700",sapien.Aenean.massa@aliquetvelvulputate.org,Q5E 8W7,207
Charde N. Singleton,"luctus sit amet, faucibus ut, nulla. Cras eu tellus eu","lacus, varius et, euismod et, commodo at, libero. Morbi",164,"Wed, 31 Aug 2011 03:30:04 -0700",nec.ante.Maecenas@orcitincidunt.org,58680,208
Cara A. Richmond,"nisl arcu iaculis enim, sit amet ornare lectus justo eu","dictum eu, eleifend nec, malesuada ut, sem. Nulla",165,"Sun, 16 Dec 2012 02:28:30 -0800",eros.Nam.consequat@lectusquismassa.com,20815,209
Dominique M. Watson,ante. Vivamus non lorem vitae odio sagittis semper. Nam tempor,"tellus lorem eu metus. In lorem. Donec elementum, lorem",166,"Sun, 13 Jan 2013 23:32:37 -0800",dictum.eleifend@nonummyac.edu,V3L 6I7,210
Germaine S. Knowles,"Fusce aliquam, enim nec tempus scelerisque, lorem ipsum sodales purus,",Donec fringilla. Donec feugiat,167,"Wed, 26 Jun 2013 09:53:50 -0700",vestibulum.nec.euismod@Proinultrices.ca,40492,211
Grant P. Rodriguez,"tellus sem mollis dui, in sodales elit erat vitae risus.",et ipsum cursus vestibulum. Mauris,168,"Wed, 26 Oct 2011 17:12:47 -0700",velit@urnaNullam.edu,R8J 2O8,212
Kennan P. Orr,"natoque penatibus et magnis dis parturient montes, nascetur ridiculus mus.",lobortis,169,"Sun, 29 Jul 2012 17:35:33 -0700",augue@malesuadaaugueut.edu,64622,213
Belle H. Roberson,"mollis dui, in sodales elit erat vitae risus. Duis a",Aenean sed,170,"Wed, 13 Feb 2013 06:57:54 -0800",in.felis.Nulla@ornareelit.org,33009,214
Lev M. Casey,Quisque ornare tortor at risus. Nunc ac sem ut dolor,"libero. Integer in magna. Phasellus dolor elit, pellentesque",171,"Sat, 11 May 2013 15:25:20 -0700",adipiscing@ut.com,16099,215
Susan O. Bradley,"fermentum risus, at fringilla purus mauris a nunc. In at",tortor at risus.,172,"Mon, 16 Jan 2012 20:03:08 -0800",Donec.elementum@laoreetposuere.edu,2126,216
Amal C. Woodward,Nullam lobortis quam a felis ullamcorper viverra. Maecenas iaculis aliquet,"magna. Phasellus dolor elit, pellentesque a, facilisis non, bibendum",173,"Thu, 11 Apr 2013 09:46:03 -0700",nonummy@sedleo.ca,I7J 4I1,217
Nichole U. Dillard,"ultricies ligula. Nullam enim. Sed nulla ante, iaculis nec, eleifend",in sodales elit erat vitae risus. Duis,174,"Sat, 29 Jun 2013 12:32:39 -0700",dui.nec.urna@vitaealiquetnec.com,R4B 8T9,218
Christine D. Armstrong,"magna tellus faucibus leo, in lobortis tellus justo sit amet","imperdiet non, vestibulum nec, euismod",175,"Sun, 24 Jun 2012 20:55:42 -0700",diam@convallisantelectus.edu,Q8H 5L9,219
Dara F. Cobb,arcu. Vivamus sit amet risus. Donec egestas. Aliquam nec enim.,sed turpis,176,"Fri, 21 Oct 2011 07:55:59 -0700",felis@euelitNulla.org,18624,220
Brett M. Ellison,"nibh. Phasellus nulla. Integer vulputate, risus a ultricies adipiscing, enim","fermentum vel, mauris. Integer sem elit, pharetra ut, pharetra sed,",177,"Thu, 16 Feb 2012 21:37:17 -0800",accumsan@nibhdolor.com,J4H 5O3,221
Nita O. Brock,Sed eu nibh vulputate mauris sagittis placerat. Cras dictum ultricies,id,178,"Wed, 22 Aug 2012 00:31:29 -0700",neque@vulputateposuerevulputate.com,I5L 8K4,222
Rigel N. Jacobson,sem eget massa. Suspendisse eleifend. Cras sed leo. Cras vehicula,"egestas blandit. Nam nulla magna,",179,"Fri, 23 Nov 2012 06:25:08 -0800",amet.consectetuer@vitae.com,10865,223
Tatum S. Hurley,sit amet nulla. Donec non justo. Proin non massa non,Aenean eget magna. Suspendisse,180,"Fri, 07 Jun 2013 19:02:01 -0700",luctus@placeratCrasdictum.ca,94649,224
Andrew V. Scott,"id, blandit at, nisi. Cum sociis natoque penatibus et magnis",magna. Cras convallis convallis dolor. Quisque tincidunt,181,"Wed, 20 Jun 2012 05:54:16 -0700",feugiat@nonbibendumsed.ca,15552,225
Cameron Y. Warren,"Mauris blandit enim consequat purus. Maecenas libero est, congue a,",ac mattis velit justo nec,182,"Sat, 27 Oct 2012 20:01:56 -0700",Donec.tempor.est@natoquepenatibuset.ca,B9M 8S9,226
Josiah G. Pruitt,"felis orci, adipiscing non, luctus sit amet, faucibus ut, nulla.",lectus. Cum sociis natoque penatibus et,183,"Mon, 08 Jul 2013 00:53:47 -0700",est.congue@aliquamadipiscinglacus.org,H8I 3A8,227
Cara I. Pratt,"Aliquam tincidunt, nunc ac mattis ornare, lectus ante dictum mi,","dictum placerat, augue. Sed",184,"Thu, 18 Jul 2013 11:43:35 -0700",est.tempor@mi.com,78602,228
Buckminster S. Patrick,"lectus pede, ultrices a, auctor non, feugiat nec, diam. Duis",pharetra. Nam ac nulla. In tincidunt,185,"Mon, 21 Jan 2013 10:22:49 -0800",lacus@libero.edu,Y1K 7J3,229
Anika R. Mcknight,"rutrum urna, nec luctus felis purus ac tellus. Suspendisse sed","quis accumsan convallis, ante lectus convallis est, vitae",186,"Fri, 16 Dec 2011 21:08:41 -0800",dui.augue.eu@eget.edu,Y4Z 6R4,230
Giacomo J. Parrish,"Maecenas iaculis aliquet diam. Sed diam lorem, auctor quis, tristique","quis lectus. Nullam suscipit, est ac",187,"Mon, 12 Sep 2011 19:18:18 -0700",Sed.eu@ipsumdolor.edu,32597,231
Genevieve P. Huber,Sed et libero. Proin mi. Aliquam gravida mauris ut mi.,Curae; Phasellus ornare. Fusce mollis. Duis sit,188,"Fri, 09 Nov 2012 01:21:37 -0800",a@et.ca,24198,232
Kaden K. Marquez,"a, dui. Cras pellentesque. Sed dictum. Proin eget odio. Aliquam",arcu,189,"Sat, 22 Dec 2012 11:00:03 -0800",ornare@vel.org,43988,233
Walker D. Maxwell,"elementum sem, vitae aliquam eros turpis non enim. Mauris quis",non sapien molestie orci tincidunt adipiscing.,190,"Mon, 03 Oct 2011 01:13:34 -0700",amet.orci.Ut@sit.ca,Y7S 5D8,234
Lucas Y. Church,"lectus sit amet luctus vulputate, nisi sem semper erat, in",feugiat placerat velit.,191,"Wed, 21 Mar 2012 07:33:33 -0700",elementum.lorem@ligulaDonecluctus.ca,67279,235
Rhiannon Q. Blair,risus. Donec egestas. Duis ac arcu. Nunc mauris. Morbi non,dui augue,192,"Mon, 26 Dec 2011 13:13:59 -0800",eleifend@enimCurabitur.edu,A9S 2W5,236
Idona B. Dunn,molestie. Sed id risus quis diam luctus lobortis. Class aptent,In,193,"Fri, 28 Oct 2011 20:16:04 -0700",semper@acmi.edu,S8J 4C5,237
Yvonne X. Fitzpatrick,eget nisi dictum augue malesuada malesuada. Integer id magna et,"vestibulum nec, euismod",194,"Tue, 30 Oct 2012 00:06:15 -0700",amet.diam@Quisqueaclibero.com,98091,238
Bree E. Serrano,"Nulla facilisis. Suspendisse commodo tincidunt nibh. Phasellus nulla. Integer vulputate,",arcu imperdiet ullamcorper. Duis,195,"Wed, 23 Jan 2013 02:52:44 -0800",erat.eget.tincidunt@infaucibusorci.ca,V5C 2K6,239
Flavia H. Hamilton,malesuada. Integer id magna et ipsum cursus vestibulum. Mauris magna.,"vel, venenatis vel,",196,"Sun, 09 Jun 2013 21:53:56 -0700",semper@nullaInteger.edu,2311,240
Odysseus A. Cote,"dui, semper et, lacinia vitae, sodales at, velit. Pellentesque ultricies","sed consequat auctor, nunc nulla vulputate dui, nec tempus mauris",197,"Tue, 29 Jan 2013 20:10:43 -0800",arcu.et@augueeu.edu,27060,241
Leroy S. Travis,"suscipit, est ac facilisis facilisis, magna tellus faucibus leo, in","torquent per conubia nostra, per inceptos hymenaeos. Mauris ut quam",198,"Fri, 29 Jul 2011 02:03:38 -0700",non.cursus@Suspendissealiquetmolestie.com,R5Y 8M2,242
Sade Q. Dominguez,Proin ultrices. Duis volutpat nunc sit amet metus. Aliquam erat,"accumsan convallis, ante lectus convallis est, vitae sodales nisi",199,"Wed, 29 May 2013 22:38:56 -0700",mauris@elitEtiamlaoreet.org,W2F 6T2,243
Ryan I. Deleon,"et magnis dis parturient montes, nascetur ridiculus mus. Aenean eget",Etiam bibendum fermentum metus. Aenean sed pede nec,200,"Mon, 17 Jun 2013 04:58:17 -0700",Mauris.eu.turpis@a.com,1879,244
