The Name,Words,Numbers,Series,Updated At,Email,Zip,ASC
Xenos O. Mosley,"metus. In lorem. Donec elementum, lorem ut aliquam iaculis, lacus","augue, eu tempor erat",1,"Thu, 01 Sep 2011 13:29:21 -0700",arcu.ac@Suspendisseseddolor.com,92738,45
Pearl V. Riggs,"dui, in sodales elit erat vitae risus. Duis a mi",bibendum ullamcorper. Duis,2,"Fri, 08 Jun 2012 16:06:07 -0700",rutrum.Fusce@euismodurnaNullam.edu,7472,46
Florence D. Burnett,"sem egestas blandit. Nam nulla magna, malesuada vel, convallis in,","semper rutrum. Fusce dolor quam, elementum at, egestas a,",3,"Thu, 19 Jul 2012 19:45:00 -0700",ornare.Fusce@adipiscingMaurismolestie.com,P3F 4D0,47
Marsden M. Powell,"magnis dis parturient montes, nascetur ridiculus mus. Donec dignissim magna","ipsum ac mi eleifend egestas. Sed pharetra,",4,"Sat, 20 Aug 2011 20:26:50 -0700",eleifend.nec.malesuada@ligulaNullamenim.org,89798,48
Lunea F. Wilder,erat neque non quam. Pellentesque habitant morbi tristique senectus et,"nibh enim, gravida sit amet, dapibus id,",5,"Sat, 09 Feb 2013 20:42:19 -0800",gravida@rutrum.com,S4D 4W8,49
Blaine Q. Odonnell,"Aliquam ornare, libero at auctor ullamcorper, nisl arcu iaculis enim,",vitae purus gravida sagittis. Duis gravida. Praesent,6,"Sat, 28 Apr 2012 14:49:51 -0700",litora.torquent.per@fermentumvelmauris.edu,86805,50
Lacey U. Macdonald,Donec at arcu. Vestibulum ante ipsum primis in faucibus orci,urna. Vivamus molestie dapibus ligula. Aliquam erat,7,"Tue, 06 Mar 2012 04:58:37 -0800",gravida@purus.com,31607,51
Todd X. Morales,Duis volutpat nunc sit amet metus. Aliquam erat volutpat. Nulla,"egestas blandit. Nam nulla magna, malesuada vel, convallis in, cursus",8,"Mon, 03 Sep 2012 13:58:07 -0700",Suspendisse.dui.Fusce@parturientmontesnascetur.org,61229,52
Vernon H. Underwood,"elementum at, egestas a, scelerisque sed, sapien. Nunc pulvinar arcu","quis,",9,"Fri, 30 Mar 2012 03:36:12 -0700",erat.Vivamus@atliberoMorbi.com,92451,53
Edward Z. Johnston,magna. Sed eu eros. Nam consequat dolor vitae dolor. Donec,"velit egestas lacinia. Sed congue,",10,"Tue, 17 Jul 2012 16:27:58 -0700",scelerisque.sed.sapien@Sedauctor.edu,60563,54
Lamar T. Olsen,"non, egestas a, dui. Cras pellentesque. Sed dictum. Proin eget","aliquet,",11,"Mon, 10 Jun 2013 13:01:54 -0700",ante@interdum.ca,58898,55
Victor P. Hobbs,"ullamcorper, velit in aliquet lobortis, nisi nibh lacinia orci, consectetuer",dolor. Fusce feugiat. Lorem ipsum,12,"Tue, 29 May 2012 13:48:46 -0700",Donec@Nullamscelerisque.org,M1R 2V7,56
Clementine U. Holman,"velit egestas lacinia. Sed congue, elit sed consequat auctor, nunc",posuere cubilia Curae; Donec tincidunt. Donec,13,"Sun, 18 Nov 2012 03:07:54 -0800",Aenean.eget@placerat.ca,G8R 8O1,57
Ruth T. Parsons,"Nulla tincidunt, neque vitae semper egestas, urna justo faucibus lectus,",sit amet orci. Ut sagittis lobortis,14,"Sat, 14 Jan 2012 01:44:04 -0800",pede.ac@sitamet.edu,Z4V 8D3,58
Kareem L. Morrow,sagittis. Nullam vitae diam. Proin dolor. Nulla semper tellus id,auctor,15,"Mon, 17 Oct 2011 03:24:04 -0700",hymenaeos@ultricies.edu,89453,59
Alexa V. Beach,"eu, accumsan sed, facilisis vitae, orci. Phasellus dapibus quam quis","dolor quam, elementum at, egestas a, scelerisque",16,"Fri, 07 Dec 2012 17:58:24 -0800",elit@pede.ca,71346,60
Austin Z. Hopkins,iaculis odio. Nam interdum enim non nisi. Aenean eget metus.,"pede, nonummy ut, molestie in, tempus eu, ligula.",17,"Thu, 08 Sep 2011 16:16:00 -0700",mauris.a.nunc@Integeridmagna.org,D1L 2X5,61
Rhea T. Warner,"amet, consectetuer adipiscing elit. Etiam laoreet, libero et tristique pellentesque,","tristique ac, eleifend vitae, erat. Vivamus nisi. Mauris nulla. Integer",18,"Sat, 16 Jun 2012 10:25:20 -0700",aliquet.odio@feugiat.edu,31932,62
Nayda A. Mcgowan,"rutrum eu, ultrices sit amet, risus. Donec nibh enim, gravida",eros non enim commodo hendrerit. Donec,19,"Mon, 02 Jan 2012 17:10:47 -0800",Fusce@pedeultricesa.com,29616,
Jerome B. Byrd,Fusce aliquet magna a neque. Nullam ut nisi a odio,"nec, malesuada ut, sem. Nulla interdum. Curabitur dictum. Phasellus in",20,"Sun, 11 Dec 2011 17:35:44 -0800",enim.nisl.elementum@faucibusorciluctus.edu,64424,
Troy A. Rios,gravida sagittis. Duis gravida. Praesent eu nulla at sem molestie,arcu ac orci. Ut semper pretium neque. Morbi,21,"Sun, 26 Aug 2012 06:50:36 -0700",felis.Nulla@montesnascetur.edu,V8T 9W8,
Stella R. Bauer,"magna, malesuada vel, convallis in, cursus et, eros. Proin ultrices.","consequat, lectus sit amet luctus vulputate, nisi sem",22,"Thu, 26 Apr 2012 10:45:44 -0700",felis@Duiselementum.ca,88589,
Devin L. Mclean,"augue porttitor interdum. Sed auctor odio a purus. Duis elementum,",eu eros. Nam,23,"Thu, 10 Nov 2011 18:06:03 -0800",rutrum.urna@utlacusNulla.com,21737,
Melvin R. Bradshaw,"rhoncus. Donec est. Nunc ullamcorper, velit in aliquet lobortis, nisi",Aliquam adipiscing lobortis risus. In mi,24,"Tue, 29 Jan 2013 04:05:11 -0800",sagittis@lobortisauguescelerisque.com,Y3S 5S1,
Plato T. Sanford,"dictum placerat, augue. Sed molestie. Sed id risus quis diam",vitae aliquam eros turpis non enim. Mauris quis,25,"Mon, 29 Oct 2012 01:36:54 -0700",in.aliquet@metusurna.com,31808,
Hu A. Ewing,"Quisque libero lacus, varius et, euismod et, commodo at, libero.",magna a neque.,26,"Fri, 07 Dec 2012 01:01:11 -0800",sed@adipiscing.com,15392,
Leah L. Pollard,risus. Donec egestas. Aliquam nec enim. Nunc ut erat. Sed,egestas. Aliquam fringilla cursus purus.,27,"Wed, 25 Apr 2012 00:58:26 -0700",dictum.mi.ac@dictumProin.edu,E9V 5Z7,
Miriam X. Barton,odio tristique pharetra. Quisque ac libero nec ligula consectetuer rhoncus.,aliquet,28,"Fri, 10 May 2013 06:45:03 -0700",Cras.dolor.dolor@eudolor.ca,N5E 9Q6,
Ross O. Green,"justo faucibus lectus, a sollicitudin orci sem eget massa. Suspendisse","iaculis quis, pede. Praesent eu",29,"Fri, 16 Nov 2012 09:42:48 -0800",pede.nec.ante@loremfringilla.edu,38631,
Montana V. Norman,"ornare, facilisis eget, ipsum. Donec sollicitudin adipiscing ligula. Aenean gravida",odio. Nam,30,"Sat, 22 Oct 2011 21:27:40 -0700",quis@variusultrices.ca,44380,
Reed Q. Fowler,"aliquet, metus urna convallis erat, eget tincidunt dui augue eu","amet diam eu dolor egestas rhoncus. Proin nisl sem, consequat",31,"Tue, 27 Mar 2012 20:23:37 -0700",Aenean@parturientmontesnascetur.ca,Z1C 7W4,
Shafira S. Welch,molestie tellus. Aenean egestas hendrerit neque. In ornare sagittis felis.,eu nibh vulputate mauris sagittis placerat.,32,"Mon, 24 Oct 2011 15:46:31 -0700",diam@Phasellus.org,73149,76
Berk F. Mueller,Curabitur dictum. Phasellus in felis. Nulla tempor augue ac ipsum.,"Curabitur consequat, lectus sit amet",33,"Fri, 30 Sep 2011 04:38:49 -0700",mollis@nonegestasa.ca,94491,77
Tanya R. Kirkland,Aenean euismod mauris eu elit. Nulla facilisi. Sed neque. Sed,metus. Aenean sed pede nec ante blandit,34,"Fri, 17 Feb 2012 22:27:52 -0800",vitae.purus.gravida@duinec.com,14786,78
Tyrone N. Ferguson,"elit. Aliquam auctor, velit eget laoreet posuere, enim nisl elementum",magna. Phasellus,35,"Wed, 30 Jan 2013 16:40:38 -0800",gravida@Naminterdumenim.org,A7H 5J4,79
Carter M. Atkins,sed pede. Cum sociis natoque penatibus et magnis dis parturient,fermentum arcu. Vestibulum ante ipsum primis,36,"Wed, 18 Jul 2012 15:56:00 -0700",mollis.nec.cursus@auctorMauris.ca,V8M 4U6,80
Quamar V. Swanson,In scelerisque scelerisque dui. Suspendisse ac metus vitae velit egestas,"ut lacus. Nulla tincidunt, neque vitae semper egestas, urna justo",37,"Mon, 02 Jan 2012 02:58:40 -0800",accumsan@massa.org,X7M 4A0,81
Liberty D. Sandoval,"dolor. Fusce feugiat. Lorem ipsum dolor sit amet, consectetuer adipiscing",purus,38,"Sat, 25 May 2013 19:37:44 -0700",Donec@ultricesVivamusrhoncus.edu,39416,82
Ishmael V. Mccarty,"vel est tempor bibendum. Donec felis orci, adipiscing non, luctus",orci luctus et ultrices posuere cubilia Curae;,39,"Wed, 21 Dec 2011 03:16:48 -0800",eros.turpis.non@blandit.org,66147,83
Baxter U. Kline,"ullamcorper, nisl arcu iaculis enim, sit amet ornare lectus justo",amet nulla. Donec non,40,"Sat, 01 Sep 2012 11:12:29 -0700",montes.nascetur.ridiculus@at.com,51119,84
Knox F. Rose,mus. Proin vel nisl. Quisque fringilla euismod enim. Etiam gravida,arcu eu odio tristique pharetra. Quisque ac libero nec ligula,41,"Fri, 20 Jan 2012 11:49:11 -0800",Etiam@erosProinultrices.edu,30088,85
Francesca L. Craft,"facilisis eget, ipsum. Donec sollicitudin adipiscing ligula. Aenean gravida nunc","vel, faucibus id, libero. Donec consectetuer mauris id",42,"Fri, 03 May 2013 23:31:15 -0700",amet.lorem@augue.com,H3Z 1N4,86
Amethyst R. Spencer,"dolor dolor, tempus non, lacinia at, iaculis quis, pede. Praesent",egestas nunc sed libero. Proin sed turpis nec,43,"Tue, 15 Nov 2011 07:20:12 -0800",parturient.montes.nascetur@laoreetipsumCurabitur.org,70913,87
Nolan Z. Rose,ipsum nunc id enim. Curabitur massa. Vestibulum accumsan neque et,felis.,44,"Sat, 14 Jan 2012 15:00:06 -0800",ultrices@enimEtiam.com,19696,88
Doris F. Osborne,"cursus luctus, ipsum leo elementum sem, vitae aliquam eros turpis",odio. Aliquam vulputate ullamcorper,45,"Wed, 06 Mar 2013 21:02:28 -0800",magna@luctusaliquetodio.edu,93573,89
Juliet O. Scott,interdum feugiat. Sed nec metus facilisis lorem tristique aliquet. Phasellus,Nunc sed orci lobortis,46,"Mon, 29 Aug 2011 01:44:52 -0700",at.fringilla@lobortismauris.ca,M4O 2Q6,90
Justin T. Ratliff,fringilla euismod enim. Etiam gravida molestie arcu. Sed eu nibh,"blandit at, nisi. Cum sociis natoque penatibus",47,"Tue, 20 Sep 2011 07:10:05 -0700",magnis.dis@vulputateposuere.edu,H6A 8J3,91
Theodore E. Pruitt,"Sed nulla ante, iaculis nec, eleifend non, dapibus rutrum, justo.",sollicitudin commodo ipsum.,48,"Wed, 16 Jan 2013 23:05:56 -0800",neque.pellentesque.massa@felisullamcorper.ca,B4T 8X4,92
Ezra Y. Huffman,semper tellus id nunc interdum feugiat. Sed nec metus facilisis,sapien. Nunc pulvinar arcu,49,"Sun, 16 Dec 2012 17:13:56 -0800",lobortis.ultrices.Vivamus@Aliquamgravida.org,I5U 5A0,93
Ifeoma S. Santiago,in sodales elit erat vitae risus. Duis a mi fringilla,nisi dictum,50,"Wed, 18 Apr 2012 16:25:21 -0700",ultrices.posuere.cubilia@idanteNunc.edu,93291,94
Mason B. Wilder,"sodales at, velit. Pellentesque ultricies dignissim lacus. Aliquam rutrum lorem",Quisque tincidunt pede ac urna. Ut tincidunt,51,"Wed, 22 Feb 2012 22:03:13 -0800",lorem.sit.amet@viverraMaecenas.com,34211,95
Amaya S. Graham,malesuada fames ac turpis egestas. Aliquam fringilla cursus purus. Nullam,libero. Donec consectetuer mauris id sapien.,52,"Sun, 17 Feb 2013 08:17:48 -0800",Duis.cursus@vestibulumneque.ca,30331,96
Nehru D. Weber,"Ut tincidunt orci quis lectus. Nullam suscipit, est ac facilisis","est ac mattis semper, dui lectus rutrum",53,"Tue, 13 Sep 2011 07:44:45 -0700",a.odio.semper@Aenean.org,56684,97
Jamalia B. Horton,"libero lacus, varius et, euismod et, commodo at, libero. Morbi",Aenean,54,"Wed, 10 Jul 2013 06:09:24 -0700",lacus@montes.edu,1293,98
Ruth V. Mcconnell,"Etiam ligula tortor, dictum eu, placerat eget, venenatis a, magna.","sem, vitae aliquam eros turpis non enim.",55,"Sun, 19 Aug 2012 19:07:36 -0700",lorem@faucibusleoin.ca,L3U 9J6,99
Xanthus Z. Silva,"Morbi neque tellus, imperdiet non, vestibulum nec, euismod in, dolor.",et,56,"Sun, 16 Sep 2012 07:32:36 -0700",mauris@molestieSedid.ca,55243,100
Tana M. Mcclure,eget metus. In nec orci. Donec nibh. Quisque nonummy ipsum,Aliquam ultrices iaculis,57,"Fri, 23 Mar 2012 18:45:55 -0700",massa.non.ante@ornarelectus.com,R1K 5B4,101
Keefe L. Potter,tincidunt aliquam arcu. Aliquam ultrices iaculis odio. Nam interdum enim,dignissim pharetra. Nam ac nulla.,58,"Fri, 04 May 2012 01:16:25 -0700",tristique.senectus.et@interdum.com,81332,102
Magee G. Harris,"diam eu dolor egestas rhoncus. Proin nisl sem, consequat nec,",mattis. Cras eget nisi dictum augue malesuada malesuada. Integer id,59,"Sat, 29 Jun 2013 13:32:52 -0700",placerat.velit@Nunc.ca,72246,103
Flynn J. Terry,"eleifend nec, malesuada ut, sem. Nulla interdum. Curabitur dictum. Phasellus","massa lobortis ultrices. Vivamus rhoncus. Donec est. Nunc ullamcorper, velit",60,"Fri, 30 Mar 2012 23:06:26 -0700",id.risus@aliquamenim.com,77319,104
Margaret N. Browning,"per conubia nostra, per inceptos hymenaeos. Mauris ut quam vel","Sed congue, elit sed consequat",61,"Thu, 18 Jul 2013 13:57:36 -0700",nisl.arcu.iaculis@Vivamusrhoncus.com,11005,105
Cora G. Baldwin,purus. Nullam scelerisque neque sed sem egestas blandit. Nam nulla,magna a tortor.,62,"Sun, 26 May 2013 19:27:21 -0700",luctus@duiCras.com, 24439,106
Quail S. Stuart,urna. Nunc quis arcu vel quam dignissim pharetra. Nam ac,consequat purus.,63,"Wed, 30 Jan 2013 16:24:20 -0800",Curabitur.vel@sapiencursusin.ca,63166,107
Abbot I. Wilkins,"montes, nascetur ridiculus mus. Proin vel arcu eu odio tristique",feugiat. Sed nec metus facilisis lorem tristique aliquet.,64,"Mon, 21 Nov 2011 19:55:34 -0800",aliquet.sem@arcuVestibulum.org,C5X 9F6,108
Cathleen A. Hardy,neque non quam. Pellentesque habitant morbi tristique senectus et netus,"suscipit, est ac",65,"Mon, 27 May 2013 03:37:01 -0700",malesuada.ut.sem@netus.com,63996  ,109
Lucy C. Richards,nec tempus mauris erat eget ipsum. Suspendisse sagittis. Nullam vitae,"pharetra, felis eget varius",66,"Tue, 16 Apr 2013 03:09:48 -0700",sociis@eratnequenon.com,140,110
Wilma Q. Perkins,"iaculis quis, pede. Praesent eu dui. Cum sociis natoque penatibus",ultrices. Duis volutpat nunc sit amet metus. Aliquam erat volutpat.,67," Fri, 15 Jun 2012 13:31:36 -0700  ",faucibus.orci.luctus@malesuadaaugueut.org,32313,111
Ayanna D. Maldonado,"lectus, a sollicitudin orci sem eget massa. Suspendisse eleifend. Cras",aliquam,68,"Wed, 14 Nov 2012 11:26:54 -0800",orci@volutpat.com,T5C 5D7,112
Hayden L. Adams,"Duis cursus, diam at pretium aliquet, metus urna convallis erat,","lorem eu metus. In lorem. Donec elementum, lorem ut",69,"Sat, 05 May 2012 03:19:35 -0700",Sed@neque.ca,S9Y 8J0,113
Urielle N. Mclean,"vulputate, posuere vulputate, lacus. Cras interdum. Nunc sollicitudin commodo ipsum.","adipiscing elit. Aliquam auctor, velit eget laoreet posuere, enim nisl",70,"Sat, 24 Sep 2011 23:14:55 -0700",auctor@aliquameros.edu,85631,114
Jackson J. Carter,"Morbi neque tellus, imperdiet non, vestibulum nec, euismod in, dolor.",Suspendisse ac metus vitae,71,"Mon, 04 Mar 2013 11:59:55 -0800",ipsum.dolor.sit@elitEtiam.org,D7F 7H1,115
Melyssa F. English,ac risus. Morbi metus. Vivamus euismod urna. Nullam lobortis quam,ligula. Aliquam erat volutpat. Nulla dignissim. Maecenas ornare,72,"Fri, 16 Sep 2011 14:02:44 -0700",eget.massa@metus.edu,25764,116
Bo I. Grimes,"risus. Quisque libero lacus, varius et, euismod et, commodo at,",odio. Aliquam vulputate ullamcorper magna. Sed eu eros. Nam,73,"Fri, 17 Aug 2012 22:35:18 -0700",Sed.nunc@Sed.com,64697,117
Ainsley C. Perez,"dapibus rutrum, justo. Praesent luctus. Curabitur egestas nunc sed libero.",libero nec,74,"Thu, 05 Jul 2012 22:49:24 -0700",id.ante@eratinconsectetuer.org,51784,118
Mark P. Patton,In faucibus. Morbi vehicula. Pellentesque tincidunt tempus risus. Donec egestas.,"scelerisque neque sed sem egestas blandit. Nam nulla magna,",75,"Mon, 13 Feb 2012 16:04:07 -0800",sapien.Aenean.massa@semperetlacinia.org,23503,119
Barclay T. Caldwell,turpis. In condimentum. Donec at arcu. Vestibulum ante ipsum primis,"magnis dis parturient montes,",76,"Sat, 07 Jul 2012 23:22:32 -0700",adipiscing.elit@Praesent.edu,B6R 7G9,120
Leigh Q. Burch,pharetra. Nam ac nulla. In tincidunt congue turpis. In condimentum.,"pharetra ut, pharetra sed, hendrerit a, arcu. Sed et libero.",77,"Tue, 16 Apr 2013 12:40:08 -0700",tellus.Suspendisse@mus.edu,B2K 8W6,121
Imogene R. Kane,Morbi quis urna. Nunc quis arcu vel quam dignissim pharetra.,tempor erat neque non quam. Pellentesque habitant,78,"Mon, 11 Mar 2013 10:56:13 -0700",orci.Ut.semper@nonbibendum.com,30897,122
Serena D. Wheeler,"consectetuer rhoncus. Nullam velit dui, semper et, lacinia vitae, sodales",metus facilisis lorem,79,"Wed, 17 Apr 2013 11:59:23 -0700",nec.tempus@blanditatnisi.ca,35082,123
Pamela C. Knight,"neque. In ornare sagittis felis. Donec tempor, est ac mattis",Praesent interdum ligula,80,"Sun, 02 Sep 2012 01:26:41 -0700",massa.lobortis.ultrices@orcitincidunt.ca,H5B 3R3,124
Jaden U. Hinton,"dapibus gravida. Aliquam tincidunt, nunc ac mattis ornare, lectus ante",Mauris molestie pharetra,81,"Wed, 17 Apr 2013 14:37:44 -0700",elementum.lorem.ut@sodalesat.ca,56060,125
Dara A. Faulkner,"nec ante. Maecenas mi felis, adipiscing fringilla, porttitor vulputate, posuere","ornare, libero at auctor ullamcorper, nisl arcu",82,"Wed, 02 May 2012 08:18:02 -0700",mi.eleifend.egestas@cubiliaCurae;.ca,82230,126
Cheyenne I. Macias,"aliquet nec, imperdiet nec, leo. Morbi neque tellus, imperdiet non,","risus odio, auctor vitae,",83,"Sat, 11 Feb 2012 16:37:05 -0800",augue@nuncac.ca,69789,127
Nathan G. Lambert,velit. Quisque varius. Nam porttitor scelerisque neque. Nullam nisl. Maecenas,eu sem. Pellentesque ut,84,"Wed, 01 Aug 2012 08:20:47 -0700",mi.pede@Donecnibh.com,84038,128
Athena U. Richmond,"augue ut lacus. Nulla tincidunt, neque vitae semper egestas, urna",vel,85,"Sun, 12 Aug 2012 08:27:19 -0700",risus@lacusCrasinterdum.ca,87230,129
Madeline W. Olson,"Proin nisl sem, consequat nec, mollis vitae, posuere at, velit.","egestas hendrerit neque. In ornare sagittis felis. Donec tempor,",86,"Sun, 14 Apr 2013 19:39:18 -0700",rutrum.lorem.ac@magnaNam.ca,Y6O 7L9,130
Patience H. Owens,"eget tincidunt dui augue eu tellus. Phasellus elit pede, malesuada",Mauris non dui nec urna,87,"Mon, 18 Feb 2013 00:46:32 -0800",vestibulum.massa@vitae.com,H8C 2D9,131
Madonna I. Stewart,"imperdiet ullamcorper. Duis at lacus. Quisque purus sapien, gravida non,","aliquet vel, vulputate eu, odio.",88,"Sat, 15 Sep 2012 16:15:52 -0700",urna.justo@pulvinararcuet.edu,A8Y 3M4,132
Josiah L. Webb,nunc sed libero. Proin sed turpis nec mauris blandit mattis.,est arcu,89,"Tue, 24 Apr 2012 18:41:51 -0700",orci.Ut.sagittis@quamelementum.org,2532,133
Amal T. Lara,"Donec felis orci, adipiscing non, luctus sit amet, faucibus ut,","sem mollis dui, in",90,"Sun, 06 May 2012 04:29:59 -0700",hendrerit.consectetuer@bibendumDonecfelis.org,Y9O 9K1,134
Barclay B. Bright,dignissim tempor arcu. Vestibulum ut eros non enim commodo hendrerit.,vulputate ullamcorper magna. Sed eu eros. Nam,91,"Mon, 30 Jan 2012 11:41:32 -0800",vitae@massa.ca,R1A 4M3,135
Cooper Y. Baxter,"lacus. Quisque purus sapien, gravida non, sollicitudin a, malesuada id,",Sed auctor odio a purus.,92,"Fri, 15 Jun 2012 05:08:59 -0700",risus@fermentummetus.com,74989,136
Lev E. Wiley,"velit eget laoreet posuere, enim nisl elementum purus, accumsan interdum",quis lectus.,93,"Sat, 15 Jun 2013 23:48:24 -0700",consectetuer.cursus.et@erat.org,59958,137
Wade I. Barton,Ut tincidunt vehicula risus. Nulla eget metus eu erat semper,tincidunt congue turpis. In condimentum.,94,"Wed, 02 Nov 2011 15:04:51 -0700",Quisque.imperdiet.erat@duiFusce.edu,I2A 3J0,138
Helen A. White,"tellus, imperdiet non, vestibulum nec, euismod in, dolor. Fusce feugiat.",tincidunt vehicula risus.,95,"Sun, 18 Mar 2012 15:37:25 -0700",quis.pede@etrutrum.ca,J8D 7W6,139
Hilary K. Lopez,"dapibus gravida. Aliquam tincidunt, nunc ac mattis ornare, lectus ante",Donec,96,"Sat, 19 Jan 2013 23:14:01 -0800",arcu.eu@Vivamusmolestiedapibus.org,K1E 4A4,140
Ingrid J. Mcconnell,"pharetra sed, hendrerit a, arcu. Sed et libero. Proin mi.",ultrices,97,"Sat, 03 Mar 2012 00:31:55 -0800",Sed@mauris.edu,75424,141
Jameson V. Sharpe,"sem mollis dui, in sodales elit erat vitae risus. Duis",Phasellus vitae mauris sit amet lorem semper,98,"Mon, 15 Oct 2012 05:17:08 -0700",malesuada.vel@utnulla.edu,44407,142
Hedy A. Camacho,"adipiscing non, luctus sit amet, faucibus ut, nulla. Cras eu",orci. Phasellus dapibus quam quis diam.,99,"Wed, 21 Mar 2012 08:39:13 -0700",ipsum.primis@Phasellusdolorelit.com,Q7W 5O6,143
Briar C. Puckett,"in, dolor. Fusce feugiat. Lorem ipsum dolor sit amet, consectetuer","non, dapibus rutrum, justo.",100,"Tue, 04 Jun 2013 08:21:05 -0700",sociis@orci.ca,F2E 2P7,144
Donovan N. Day,Duis sit amet diam eu dolor egestas rhoncus. Proin nisl,feugiat. Sed nec metus facilisis lorem tristique,101,"Sun, 14 Apr 2013 10:36:56 -0700",sapien.imperdiet@fringillaeuismod.org,F8U 3W1,145
Scarlett L. Snyder,"lorem ut aliquam iaculis, lacus pede sagittis augue, eu tempor",risus. In mi,102,"Wed, 24 Aug 2011 18:26:24 -0700",dolor.Fusce.mi@aodio.org,89132,146
Samuel W. Burnett,"enim. Nunc ut erat. Sed nunc est, mollis non, cursus","tincidunt, neque vitae semper egestas, urna justo",103,"Mon, 08 Apr 2013 13:35:59 -0700",tempus.lorem.fringilla@nislNulla.com,55730,147
Lana F. Oneill,"dui quis accumsan convallis, ante lectus convallis est, vitae sodales","mauris sapien,",104,"Wed, 22 May 2013 09:05:10 -0700",erat.in@nequeNullam.ca,71589,148
Mary K. Jordan,mauris. Suspendisse aliquet molestie tellus. Aenean egestas hendrerit neque. In,nisl elementum,105,"Sat, 06 Apr 2013 06:23:17 -0700",facilisis@Morbiquisurna.edu,12174,149
Mary A. Wood,Curabitur dictum. Phasellus in felis. Nulla tempor augue ac ipsum.,Praesent luctus. Curabitur egestas nunc sed libero. Proin sed,106,"Sat, 23 Jun 2012 20:47:34 -0700",amet.consectetuer@sollicitudin.ca,18462,150
Warren H. Sampson,fringilla. Donec feugiat metus sit amet ante. Vivamus non lorem,odio. Phasellus at augue id,107,"Sat, 19 Jan 2013 22:06:53 -0800",magna.Praesent.interdum@ipsumSuspendissenon.ca,72672,151
Russell U. Melendez,"aliquet. Proin velit. Sed malesuada augue ut lacus. Nulla tincidunt,",pede. Nunc sed orci,108,"Tue, 27 Mar 2012 07:53:53 -0700",Morbi.sit.amet@consequatlectussit.edu,O5H 4U4,152
Raya G. Warren,Vivamus molestie dapibus ligula. Aliquam erat volutpat. Nulla dignissim. Maecenas,"cursus. Nunc mauris elit, dictum eu, eleifend nec,",109,"Tue, 27 Mar 2012 07:06:14 -0700",tincidunt@variusNamporttitor.com,61235,153
May H. Horton,"dui. Fusce diam nunc, ullamcorper eu, euismod ac, fermentum vel,",dictum. Phasellus in felis.,110,"Sun, 14 Oct 2012 16:57:26 -0700",dolor@dolortempusnon.ca,K3X 4O2,154
Basia L. Poole,"ornare, elit elit fermentum risus, at fringilla purus mauris a",erat neque non quam. Pellentesque habitant morbi,111,"Wed, 14 Mar 2012 10:44:58 -0700",Aliquam@euodio.org,92311,155
Macaulay I. Hancock,augue. Sed molestie. Sed id risus quis diam luctus lobortis.,"feugiat non,",112,"Sat, 10 Mar 2012 10:34:46 -0800",litora@Suspendissealiquet.edu,4879,156
Luke U. Hernandez,"fermentum convallis ligula. Donec luctus aliquet odio. Etiam ligula tortor,","Proin nisl sem, consequat nec, mollis vitae, posuere",113,"Thu, 04 Apr 2013 03:30:45 -0700",ut@Duis.com,F6A 6Y2,157
Odysseus L. Stein,"vestibulum nec, euismod in, dolor. Fusce feugiat. Lorem ipsum dolor","posuere vulputate, lacus.",114,"Tue, 23 Apr 2013 07:31:43 -0700",vulputate@atiaculisquis.org,53131,158
Shellie G. Mcdaniel,"est, mollis non, cursus non, egestas a, dui. Cras pellentesque.","lorem lorem, luctus ut, pellentesque eget, dictum",115,"Thu, 07 Feb 2013 23:27:43 -0800",a.dui@liberoest.edu,C4T 9W7,159
Cheryl X. Schmidt,lorem vitae odio sagittis semper. Nam tempor diam dictum sapien.,malesuada. Integer id magna et ipsum cursus vestibulum.,116,"Mon, 29 Oct 2012 12:05:29 -0700",molestie.arcu.Sed@Sed.org,I5B 6Q7,160
Ryder W. Cooley,risus. Donec egestas. Duis ac arcu. Nunc mauris. Morbi non,"lacus. Quisque purus sapien,",117,"Sat, 02 Mar 2013 23:29:59 -0800",convallis@Innec.com,V6D 7T9,161
Flynn M. Mendoza,"auctor odio a purus. Duis elementum, dui quis accumsan convallis,",turpis vitae purus gravida sagittis. Duis gravida. Praesent eu,118,"Wed, 18 Jul 2012 01:03:39 -0700",eu.odio.Phasellus@adipiscingelitCurabitur.org,T6N 6W9,162
Mason J. Church,sit amet risus. Donec egestas. Aliquam nec enim. Nunc ut,mi fringilla mi,119,"Sat, 13 Jul 2013 10:10:18 -0700",non.egestas@Namligula.ca,N2U 9R6,163
Cameran U. Mcgowan,eu tempor erat neque non quam. Pellentesque habitant morbi tristique,Praesent luctus. Curabitur egestas nunc sed,120,"Sun, 20 May 2012 23:25:55 -0700",lorem@ac.edu,66197,164
Hiroko E. Rosales,"amet, dapibus id, blandit at, nisi. Cum sociis natoque penatibus",tempus mauris erat,121,"Tue, 13 Nov 2012 07:03:09 -0800",placerat.velit@enim.edu,G8K 8P2,165
Ishmael L. Cardenas,"ornare, elit elit fermentum risus, at fringilla purus mauris a","libero est, congue",122,"Thu, 19 Apr 2012 08:29:07 -0700",et.ultrices.posuere@nectempusscelerisque.com,27542,166
Renee R. Castaneda,"mauris elit, dictum eu, eleifend nec, malesuada ut, sem. Nulla",Pellentesque tincidunt tempus risus. Donec,123,"Wed, 10 Oct 2012 11:00:52 -0700",aliquet.lobortis@elementumsem.edu,T4V 8V6,167
Callum L. Alvarez,Nulla dignissim. Maecenas ornare egestas ligula. Nullam feugiat placerat velit.,Vestibulum accumsan neque et nunc. Quisque ornare tortor at,124,"Wed, 10 Aug 2011 09:36:11 -0700",quis.lectus.Nullam@mauris.edu,89651,168
Brock N. Rojas,"ultrices, mauris ipsum porta elit, a feugiat tellus lorem eu","viverra. Donec tempus, lorem",125,"Tue, 11 Oct 2011 11:20:36 -0700",tortor.Nunc.commodo@Pellentesqueultricies.org,F2L 2P8,169
Aidan P. Kennedy,non justo. Proin non massa non ante bibendum ullamcorper. Duis,ullamcorper magna. Sed eu eros. Nam consequat,126,"Wed, 21 Nov 2012 06:05:09 -0800",at.augue.id@facilisisloremtristique.ca,Y1G 4V5,170
Bertha G. Rosa,"Donec nibh enim, gravida sit amet, dapibus id, blandit at,","dui, nec",127,"Tue, 26 Feb 2013 20:48:15 -0800",arcu.eu.odio@idrisusquis.org,C6Y 7E5,171
Raphael U. Whitaker,arcu. Vestibulum ante ipsum primis in faucibus orci luctus et,"natoque penatibus et magnis dis parturient montes, nascetur",128,"Tue, 10 Jul 2012 15:18:50 -0700",Etiam@nequesed.edu,Z2H 3S4,172
Zelda T. Lane,amet metus. Aliquam erat volutpat. Nulla facilisis. Suspendisse commodo tincidunt,Morbi sit amet massa. Quisque porttitor eros nec,129,"Tue, 06 Dec 2011 05:44:43 -0800",sem.egestas@euarcuMorbi.org,X3Z 6B7,173
Ezra J. David,"sem elit, pharetra ut, pharetra sed, hendrerit a, arcu. Sed","sed dui. Fusce aliquam, enim nec tempus",130,"Tue, 04 Sep 2012 19:30:00 -0700",sociis.natoque@Inscelerisque.ca,E8X 9T6,174
